{
  "id": "nl_req_high_risk_db_migration",
  "schema_version": "0.9.4",
  "project_id": "agentos",
  "input_text": "添加 Builder 输出持久化到数据库：\n- 新增 builder_outputs 表（id, nl_request_id, output_json, created_at）\n- 新增 builder_selections 表（output_id, type, content_id, evidence）\n- 添加索引：nl_request_id, created_at\n- 编写数据库迁移脚本\n- 迁移脚本需要向后兼容（不影响现有数据）\n- 更新 Builder 类以保存输出到数据库\n- 添加回滚方案",
  "context_hints": {
    "modules": [
      "database",
      "builder_service",
      "migrations"
    ],
    "areas": [
      "backend",
      "data",
      "security"
    ]
  },
  "created_at": "2026-01-25T12:00:00Z",
  "checksum": "0000000000000000000000000000000000000000000000000000000000000003",
  "lineage": {
    "introduced_in": "0.9.4",
    "derived_from": [],
    "supersedes": []
  },
  "metadata": {
    "user_id": "senior_dev_003",
    "source": "api",
    "tags": [
      "database",
      "migration",
      "high_risk"
    ]
  }
}